{
  "templateId": "customerJourneyCanvas",
  "locale": "en-US",
  "metadata": {
    "source": "",
    "license": "",
    "authors": [],
    "website": ""
  },
  "sections": [
    {
      "sectionId": "customerDiscoversNeed",
      "stickyNotes": [
        {
          "content": "Placeholder",
          "size": 80,
          "color": "#DFDDC5"
        }
      ]
    },
    {
      "sectionId": "persona",
      "stickyNotes": [
        {
          "content": "Placeholder",
          "size": 80,
          "color": "#DFDDC5"
        }
      ]
    },
    {
      "sectionId": "pains",
      "stickyNotes": [
        {
          "content": "Placeholder",
          "size": 80,
          "color": "#FFAFAF"
        }
      ]
    },
    {
      "sectionId": "journeySteps",
      "stickyNotes": [
        {
          "content": "Placeholder",
          "size": 80,
          "color": "#7DC9E7"
        }
      ]
    },
    {
      "sectionId": "customerNeedIsResolved",
      "stickyNotes": [
        {
          "content": "Placeholder",
          "size": 80,
          "color": "#C0EB6A"
        }
      ]
    },
    {
      "sectionId": "gains",
      "stickyNotes": [
        {
          "content": "Placeholder",
          "size": 80,
          "color": "#C0EB6A"
        }
      ]
    },
    {
      "sectionId": "inputsOutputs",
      "stickyNotes": [
        {
          "content": "Placeholder",
          "size": 80,
          "color": "#DFDDC5"
        }
      ]
    },
    {
      "sectionId": "interactionProcessingRules",
      "stickyNotes": [
        {
          "content": "Placeholder",
          "size": 80,
          "color": "#DFDDC5"
        }
      ]
    }
  ]
}
