{
  "templateId": "domainCanvas",
  "locale": "en-US",
  "metadata": {
    "source": "",
    "license": "",
    "authors": [],
    "website": ""
  },
  "sections": [
    {
      "sectionId": "selectedCustomerJourneySteps",
      "stickyNotes": [
        {
          "content": "Placeholder",
          "size": 80,
          "color": "#7DC9E7"
        }
      ]
    },
    {
      "sectionId": "coreEntitiesAndBusinessMeaning",
      "stickyNotes": [
        {
          "content": "Placeholder",
          "size": 80,
          "color": "#DFDDC5"
        }
      ]
    },
    {
      "sectionId": "attributesAndBusinessImportance",
      "stickyNotes": [
        {
          "content": "Placeholder",
          "size": 80,
          "color": "#DFDDC5"
        }
      ]
    },
    {
      "sectionId": "relationshipsBetweenEntities",
      "stickyNotes": [
        {
          "content": "Placeholder",
          "size": 80,
          "color": "#DFDDC5"
        }
      ]
    },
    {
      "sectionId": "businessComplianceAndIntegrityRules",
      "stickyNotes": [
        {
          "content": "Placeholder",
          "size": 80,
          "color": "#DFDDC5"
        }
      ]
    },
    {
      "sectionId": "securityAndPrivacyConsiderations",
      "stickyNotes": [
        {
          "content": "Placeholder",
          "size": 80,
          "color": "#FFAFAF"
        }
      ]
    }
  ]
}
