{
  "templateId": "eventCanvas",
  "locale": "en-US",
  "metadata": {
    "source": "",
    "license": "",
    "authors": [],
    "website": ""
  },
  "sections": [
    {
      "sectionId": "userTaskTrigger",
      "stickyNotes": [
        {
          "content": "Placeholder",
          "size": 80,
          "color": "#7DC9E7"
        }
      ]
    },
    {
      "sectionId": "inputEventPayload",
      "stickyNotes": [
        {
          "content": "Placeholder",
          "size": 80,
          "color": "#DFDDC5"
        }
      ]
    },
    {
      "sectionId": "processingLogic",
      "stickyNotes": [
        {
          "content": "Placeholder",
          "size": 80,
          "color": "#DFDDC5"
        }
      ]
    },
    {
      "sectionId": "outputEventResult",
      "stickyNotes": [
        {
          "content": "Placeholder",
          "size": 80,
          "color": "#C0EB6A"
        }
      ]
    }
  ]
}
