{
  "templateId": "businessImpactCanvas",
  "locale": "en-US",
  "metadata": {
    "source": "",
    "license": "",
    "authors": [],
    "website": ""
  },
  "sections": [
    {
      "sectionId": "availabilityRisks",
      "stickyNotes": [
        {
          "content": "Placeholder",
          "size": 80,
          "color": "#FFAFAF"
        }
      ]
    },
    {
      "sectionId": "securityRisks",
      "stickyNotes": [
        {
          "content": "Placeholder",
          "size": 80,
          "color": "#FFAFAF"
        }
      ]
    },
    {
      "sectionId": "dataRisks",
      "stickyNotes": [
        {
          "content": "Placeholder",
          "size": 80,
          "color": "#FFAFAF"
        }
      ]
    },
    {
      "sectionId": "mitigateAvailabilityRisks",
      "stickyNotes": [
        {
          "content": "Placeholder",
          "size": 80,
          "color": "#7DC9E7"
        }
      ]
    },
    {
      "sectionId": "mitigateSecurityRisks",
      "stickyNotes": [
        {
          "content": "Placeholder",
          "size": 80,
          "color": "#7DC9E7"
        }
      ]
    },
    {
      "sectionId": "mitigateDataRisks",
      "stickyNotes": [
        {
          "content": "Placeholder",
          "size": 80,
          "color": "#7DC9E7"
        }
      ]
    }
  ]
}
