{
  "templateId": "apiBusinessModelCanvas",
  "locale": "en-US",
  "metadata": {
    "source": "",
    "license": "",
    "authors": [],
    "website": ""
  },
  "sections": [
    {
      "sectionId": "keyPartners",
      "stickyNotes": [
        {
          "content": "Placeholder",
          "size": 80,
          "color": "#DFDDC5"
        }
      ]
    },
    {
      "sectionId": "keyActivities",
      "stickyNotes": [
        {
          "content": "Placeholder",
          "size": 80,
          "color": "#7DC9E7"
        }
      ]
    },
    {
      "sectionId": "keyResources",
      "stickyNotes": [
        {
          "content": "Placeholder",
          "size": 80,
          "color": "#DFDDC5"
        }
      ]
    },
    {
      "sectionId": "apiValueProposition",
      "stickyNotes": [
        {
          "content": "Placeholder",
          "size": 80,
          "color": "#C0EB6A"
        }
      ]
    },
    {
      "sectionId": "developerRelations",
      "stickyNotes": [
        {
          "content": "Placeholder",
          "size": 80,
          "color": "#DFDDC5"
        }
      ]
    },
    {
      "sectionId": "channels",
      "stickyNotes": [
        {
          "content": "Placeholder",
          "size": 80,
          "color": "#7DC9E7"
        }
      ]
    },
    {
      "sectionId": "apiConsumerSegments",
      "stickyNotes": [
        {
          "content": "Placeholder",
          "size": 80,
          "color": "#DFDDC5"
        }
      ]
    },
    {
      "sectionId": "costs",
      "stickyNotes": [
        {
          "content": "Placeholder",
          "size": 80,
          "color": "#FFAFAF"
        }
      ]
    },
    {
      "sectionId": "benefits",
      "stickyNotes": [
        {
          "content": "Placeholder",
          "size": 80,
          "color": "#C0EB6A"
        }
      ]
    }
  ]
}
