{
  "templateId": "restCanvas",
  "locale": "en-US",
  "metadata": {
    "source": "",
    "license": "",
    "authors": [],
    "website": ""
  },
  "sections": [
    {
      "sectionId": "apiResources",
      "stickyNotes": [
        {
          "content": "Placeholder",
          "size": 80,
          "color": "#DFDDC5"
        }
      ]
    },
    {
      "sectionId": "apiResourceModel",
      "stickyNotes": [
        {
          "content": "Placeholder",
          "size": 80,
          "color": "#DFDDC5"
        }
      ]
    },
    {
      "sectionId": "apiVerbs",
      "stickyNotes": [
        {
          "content": "Placeholder",
          "size": 80,
          "color": "#7DC9E7"
        }
      ]
    },
    {
      "sectionId": "apiVerbExample",
      "stickyNotes": [
        {
          "content": "Placeholder",
          "size": 80,
          "color": "#7DC9E7"
        }
      ]
    }
  ]
}
