{
  "templateId": "graphqlCanvas",
  "locale": "en-US",
  "metadata": {
    "source": "",
    "license": "",
    "authors": [],
    "website": ""
  },
  "sections": [
    {
      "sectionId": "apiName",
      "stickyNotes": [
        {
          "content": "Placeholder",
          "size": 80,
          "color": "#FFF399"
        }
      ]
    },
    {
      "sectionId": "consumerGoals",
      "stickyNotes": [
        {
          "content": "Placeholder",
          "size": 80,
          "color": "#C0EB6A"
        }
      ]
    },
    {
      "sectionId": "keyTypes",
      "stickyNotes": [
        {
          "content": "Placeholder",
          "size": 80,
          "color": "#DFDDC5"
        }
      ]
    },
    {
      "sectionId": "relationships",
      "stickyNotes": [
        {
          "content": "Placeholder",
          "size": 80,
          "color": "#DFDDC5"
        }
      ]
    },
    {
      "sectionId": "queries",
      "stickyNotes": [
        {
          "content": "Placeholder",
          "size": 80,
          "color": "#7DC9E7"
        }
      ]
    },
    {
      "sectionId": "mutations",
      "stickyNotes": [
        {
          "content": "Placeholder",
          "size": 80,
          "color": "#7DC9E7"
        }
      ]
    },
    {
      "sectionId": "subscriptions",
      "stickyNotes": [
        {
          "content": "Placeholder",
          "size": 80,
          "color": "#7DC9E7"
        }
      ]
    },
    {
      "sectionId": "authorizationRules",
      "stickyNotes": [
        {
          "content": "Placeholder",
          "size": 80,
          "color": "#FFAFAF"
        }
      ]
    },
    {
      "sectionId": "consumerConstraints",
      "stickyNotes": [
        {
          "content": "Placeholder",
          "size": 80,
          "color": "#FFAFAF"
        }
      ]
    },
    {
      "sectionId": "openQuestions",
      "stickyNotes": [
        {
          "content": "Placeholder",
          "size": 80,
          "color": "#FFF399"
        }
      ]
    }
  ]
}
