{
  "templateId": "apiValuePropositionCanvas",
  "locale": "en-US",
  "metadata": {
    "source": "",
    "license": "",
    "authors": [],
    "website": ""
  },
  "sections": [
    {
      "sectionId": "tasks",
      "stickyNotes": [
        {
          "content": "Placeholder",
          "size": 80,
          "color": "#7DC9E7"
        }
      ]
    },
    {
      "sectionId": "gainEnablingFeatures",
      "stickyNotes": [
        {
          "content": "Placeholder",
          "size": 80,
          "color": "#C0EB6A"
        }
      ]
    },
    {
      "sectionId": "painRelievingFeatures",
      "stickyNotes": [
        {
          "content": "Placeholder",
          "size": 80,
          "color": "#C0EB6A"
        }
      ]
    },
    {
      "sectionId": "apiProducts",
      "stickyNotes": [
        {
          "content": "Placeholder",
          "size": 80,
          "color": "#DFDDC5"
        }
      ]
    }
  ]
}
